{"role":"mystery","verdict":"The mystery converged too strongly against A by Phase 2 and toward a broad B/D hybrid by Phase 3, while C retained a coherent minority case. All four frameworks had advocates, but not equally durable affirmative cases: A began viable and then became largely indefensible; B had the strongest cumulative fit; C had a focused evidence-based champion but never overcame confounds; D became a strong alternative to B. Human participation became probable by consensus, but human embodiment as one identifiable R. was never proved. Murder, a murder victim, and any responsible party were not proved. These conclusions describe one isolated three-phase simulation, not statistically robust design performance.","findings":["A had an affirmative opening case based on early human artifacts, relationships, commercial continuity, and claimed encounters. Its mean was initially highest at 29.8, but the evidence mostly established contact with an account, claimant, or routine—not one person continuously authoring as R. A collapsed to 15.7 in Phase 2 and 7.0 in Phase 3.","B had the strongest cumulative affirmative case: early human association plus later shared logistics, multiple production hands, account continuity, automation, and deliberate succession. Its mean rose from 27.1 to 36.6 to 38.4, finishing first, though never near majority certainty.","C had a genuine affirmative case rather than serving only as a decoy. Machine-like timing, queued communications, distributed logistics, and self-descriptions supported synthetic origin. However, the known autoresponder and the inability to infer authorship from account behavior prevented proof. C stayed remarkably stable in aggregate—22.2, 22.6, then 23.8—while C08 reached 72 individually.","D also had an affirmative case: institutional creation of the byline, multi-voice production, anonymous logistics, false biographical trails, and an operation persisting without an identifiable resident. D rose from 20.9 to 25.1 to 30.9 and became the principal competitor to B.","Belief convergence occurred in two stages. By Phase 2, agents broadly converged against one continuously acting human after M22 and M41. By Phase 3, M26, M28, and M40 consolidated a B/D zone—maintained mantle or organized construct—with C remaining a minority alternative. The group did not converge cleanly between B and D.","Human involvement became the dominant probabilistic interpretation, but embodiment did not become proven. Nineteen of twenty final answers allowed, favored, or asserted some human participation or human-rooted origin; only C11 answered 'Probably not.' Yet final statements repeatedly denied proof of a single identifiable human R.","Murder became less credible rather than effectively proven. Mean belief that a crime occurred fell from 55.5 to 52.9 to 35.9; belief that the victim was R fell from 34.0 to 26.6 to 14.3. Final ballots overwhelmingly rejected a proven crime, identifiable victim, culprit, or homicide.","The 17–3 publication result did not resolve the ontology or murder mystery. Most agents explicitly separated verification of the article's claims from verification of R.'s identity, so release consensus should not be read as evidentiary consensus about R.","The framework ballot aggregation failed mechanically: all 20 final reconstructions were counted as 'other' even though many explicitly selected B_human_mantle or D_institutional_construct. This prevents the nominal ballot from measuring framework convergence and conflicts with the readable transcript.","The simulation structure likely amplified convergence. Agents were isolated but received the same staged evidence and repeatedly cited the same M22/M41 and M26/M40 bundles. Three phases provide evidence of directional convergence in this run, not proof that the design will remain balanced across players or repeated games."],"evidence":["Phase 1, C01/C03/C14/C16 advanced A through EV18, EV21, delivery continuity, claimed relationships, and early human encounters; C03 explicitly limited EV21 to proof of a human-written artifact rather than journalistic authorship.","Phase 1, C08 and C11 affirmatively advanced C using M27, EV16, M22, queued communication, false trails, and a manufactured-persona hypothesis; C08 assigned C=60.","Phase 1, C07 and C15 affirmatively advanced D through organized worker/logistics systems and the absence of a verified resident; C07 assigned D=40 and C15 D=45.","Phase 2, C03/C04/C09/C10/C20 shifted toward B after M22's multiple collectors and M41's automated timing; their B beliefs were 45, 53, 45, 53, and 48 respectively.","Phase 2, C08 made the strongest C case at C=65 but acknowledged the autoresponder confound; C09's forensic verdict authenticated established account infrastructure and scheduling, not a human author or synthetic origin.","Phase 2, C12 compelled EV09 but explicitly ruled that restaurant and building records proved operational continuity rather than identity, residence, harm, or homicide.","Phase 3, C03 cited EV17/M29 for institutional creation, EV21 for an early human claimant, and M26/M40 for plurality, then selected B while retaining D=35.","Phase 3, C07/C13/C15/C19 selected or described D as an organized institutional construct; their D beliefs were 45, 45, 50, and 45.","Phase 3, C08 selected synthetic origin with C=72 but still stated that the evidence could not conclusively distinguish C from a human mantle or organized construct.","Phase 3, C09/C10/C16/C20 favored B at 47, 52, 55, and 53, grounding it in shared infrastructure, several hands, automation, and early human association.","Phase 3, C02/C07/C09/C11/C12/C13/C15/C18/C19 explicitly rejected an established crime or identifiable R victim; even higher-crime C01 and C17 described suppression or interference as probable while stating homicide was unproved.","Phase 3 aggregate: A=7.0, B=38.4, C=23.8, D=30.9; crime_occurred=35.9 and victim_was_R=14.3.","Phase 3 final ballots: 17 characters voted to release, but C05/C07/C08/C09/C10/C12/C13/C15/C18/C19 conditioned release on verification, provenance warnings, or source protection rather than treating authorship as solved.","Phase 3 framework fields included exact labels such as B_human_mantle from C03, C10, C14, C16, C17, and C20, and D_institutional_construct from C02, C13, C15, and C19, despite the aggregate recording all 20 as 'other'."],"risks":["A may function as an early-game hypothesis rather than a viable final solution unless later evidence can affirm one-person continuity instead of only weakening alternatives.","B and D overlap semantically: 'maintained mantle,' 'organized construct,' and 'institutional operation' were used interchangeably, reducing the meaningfulness of choosing between them.","C depends heavily on timing and queued-message evidence whose autoresponder confound was repeatedly acknowledged; without a more discriminating clue, it may remain plausible but structurally unprovable.","Repeated shared evidence bundles can manufacture apparent consensus in a short simulation, especially when agents have no additional discovery phase or adversarial cross-examination.","Free-text ballot responses make quantitative interpretation unreliable. The reported zero votes for A/B/C/D are a parsing artifact, not player behavior.","Crime wording was broader than murder wording. Some agents marked probable suppression, fraud, or interference while rejecting homicide, so a single 'crime_occurred' score can misleadingly suggest support for murder.","Character incentives favored publication and stewardship disputes, which may have displaced investigation of disappearance and homicide rather than demonstrating that those mysteries were fully tested."],"recommendations":["Use an enumerated required framework field for A/B/C/D/hybrid, with a separate free-text explanation. Recompute this run's framework ballot from the explicit final labels before drawing conclusions.","Sharpen the distinction between B and D: define whether B requires traceable human succession and whether D requires institutional ownership or control independent of any human-rooted mantle.","Give A at least one late, independently testable continuity clue if all four solutions are intended to remain live through the finale.","Give C evidence that discriminates synthetic generation from scheduled human communication, shared accounts, and routine autoresponders; alternatively, weaken claims that C is equally solvable.","Separate ballot questions for homicide, non-homicide criminal interference, and publication suppression. Do not use general crime confidence as a proxy for murder.","Add a late investigative opportunity capable of identifying a harmed person independently of the R. byline; otherwise 'victim was R' is structurally downstream of an unresolved identity.","Run repeated simulations with varied evidence order, character assignments, and interaction protocols before judging balance. This single three-phase baseline supports only provisional design findings."],"scores":{"mystery_balance":6,"character_agency":7,"mechanical_integrity":4,"human_ai_ambiguity":8,"report_confidence":9}}